{
    "schema_version": "1.0",
    "gap_id": "SAGE-GAP-20260801-001",
    "request": "Activate the complete Kalaxy3 SAGE mandatory operating contract. Require current Git, GitHub, SAGE, and runtime authority before mutation; evidence-based selection and reuse of repository-owned components; composition manifests; capability-gap receipts; real runtime validation; failure diagnosis that records what failed, what should have been done, which existing component should have been used, why the actual path differed, and the reusable correction; measurable outcome, reuse, authority, failure, rework, and safety statistics; Git credential and history safety; and an operator-executed, visible, one-boundary-at-a-time Git/GitHub mutation gate. Downloaded implementation helpers may edit and validate repository files but may only inspect Git read-only and may not create or switch branches, stage, commit, push, pull, merge, rebase, reset, clean, delete refs, mutate GitHub, or deploy.",
    "created_at": "2026-08-01T21:55:00-05:00",
    "authority_receipt": "artifact:kalaxy3-sage-operating-contract-authority-20260801-211530.json#sha256=e1b08b7e5a6dee4205269f47baffd15ca63866cfa8263cecb79f17b9f88c9974",
    "component_manifest": "markdown/evidence-artifacts/SAGE-K3-OPERATING-CONTRACT-20260801-001/component-selection-approved.json",
    "required_capability": "Read-only Git authority inspection without mixed mutation methods.",
    "candidates_considered": [
        {
            "component_id": "git.repository",
            "version": "1.0.0",
            "source_path": "scripts/sage/workflow/git.py",
            "insufficiency": "The class exposes fetch, branch creation, staging, commit, and push in the same object.",
            "composition_can_close_gap": false
        }
    ],
    "gap": {
        "missing_interface_or_behavior": "A separate interface with no mutating methods and no fetch operation.",
        "why_configuration_is_insufficient": "Configuration cannot remove public mutating methods from the existing class.",
        "why_composition_is_insufficient": "Wrapping the mixed-authority class still grants the helper the prohibited capability.",
        "new_primitive_required": true
    },
    "proposed_primitive": {
        "primitive_id": "git.inspect",
        "responsibility": "Inspect branch, HEAD, local upstream, working-tree state, and exact changed paths through an explicit read-only allowlist.",
        "side_effects": "Read-only local Git process execution.",
        "idempotency": "Deterministic for unchanged local references and working tree.",
        "logging": "Versioned git.inspect command events with labels and output digests.",
        "failure_mode": "Unknown arguments or authority mismatch fail before repository mutation.",
        "runtime_tests": [
            "clean snapshot",
            "changed paths",
            "upstream equality",
            "mutating command rejection"
        ],
        "initial_maturity": "pilot"
    },
    "approval": {
        "status": "approved",
        "reviewed_by": "operator",
        "reviewed_at": "2026-08-01T21:25:00-05:00",
        "rationale": "The operator explicitly approved the Phase 2 least-authority safety-foundation gaps."
    },
    "evidence_references": [
        "commit:106ce43d4e790955ddeaf7a02f4f0728f67a7b80",
        "sha256:1eb688904d0776e641e7edb0ce1cc1ed6c9d13e72ec59300add520f5c740c701",
        "artifact:kalaxy3-sage-operating-contract-authority-20260801-211530.json#sha256=e1b08b7e5a6dee4205269f47baffd15ca63866cfa8263cecb79f17b9f88c9974"
    ]
}
