{
    "schema_version": "1.0",
    "gap_id": "SAGE-GAP-20260801-006",
    "request": "Activate the complete Kalaxy3 SAGE mandatory operating contract. Require current Git, GitHub, SAGE, and runtime authority before mutation; evidence-based selection and reuse of repository-owned components; composition manifests; capability-gap receipts; real runtime validation; failure diagnosis that records what failed, what should have been done, which existing component should have been used, why the actual path differed, and the reusable correction; measurable outcome, reuse, authority, failure, rework, and safety statistics; Git credential and history safety; and an operator-executed, visible, one-boundary-at-a-time Git/GitHub mutation gate. Downloaded implementation helpers may edit and validate repository files but may only inspect Git read-only and may not create or switch branches, stage, commit, push, pull, merge, rebase, reset, clean, delete refs, mutate GitHub, or deploy.",
    "created_at": "2026-08-01T22:25:00-05:00",
    "authority_receipt": "artifact:kalaxy3-sage-operating-contract-authority-20260801-211530.json#sha256=e1b08b7e5a6dee4205269f47baffd15ca63866cfa8263cecb79f17b9f88c9974",
    "component_manifest": "markdown/evidence-artifacts/SAGE-K3-OPERATING-CONTRACT-20260801-001/component-selection-decision-primitives.json",
    "required_capability": "Select repository-owned components and preserve explicit composition manifests.",
    "candidates_considered": [
        {
            "component_id": "workflow.composition",
            "version": "1.1.0",
            "source_path": "scripts/sage/workflow/composition.py",
            "insufficiency": "The existing registry and workflow composition do not rank candidates or retain rejected alternatives and gaps.",
            "composition_can_close_gap": false
        }
    ],
    "gap": {
        "missing_interface_or_behavior": "The existing registry and workflow composition do not rank candidates or retain rejected alternatives and gaps.",
        "why_configuration_is_insufficient": "Configuration cannot add a versioned typed decision contract with fail-closed semantics.",
        "why_composition_is_insufficient": "Composition can order existing capabilities but cannot create the missing semantic contract.",
        "new_primitive_required": true
    },
    "proposed_primitive": {
        "primitive_id": "component.select",
        "responsibility": "Select repository-owned components and preserve explicit composition manifests.",
        "side_effects": "in-memory receipt or manifest construction only",
        "idempotency": "deterministic for fixed inputs and timestamps",
        "logging": "caller records identifiers, dispositions, and digests without raw secrets",
        "failure_mode": "incomplete or unsafe decision state fails closed",
        "runtime_tests": [
            "positive semantic path",
            "negative fail-closed path",
            "exact contract integration"
        ],
        "initial_maturity": "pilot"
    },
    "approval": {
        "status": "approved",
        "reviewed_by": "operator",
        "reviewed_at": "2026-08-01T21:25:00-05:00",
        "rationale": "Approved as part of the operating-contract component and gap plan."
    },
    "evidence_references": [
        "commit-prefix:319f200",
        "artifact:kalaxy3-sage-operating-contract-authority-20260801-211530.json#sha256=e1b08b7e5a6dee4205269f47baffd15ca63866cfa8263cecb79f17b9f88c9974",
        "path:scripts/sage/workflow/selection.py"
    ]
}
